Original Product,Guessed Product,Review,Sentiment,Reply
iPhone 13,Expensive,"The phone has an amazing camera and the battery life is fantastic. However, the price is a bit too high for what it offers.","mixed 
","We appreciate your feedback!  We're thrilled you love the camera and battery life. We understand your concern about the price. We strive to offer premium features, and we're always working to find ways to make our products more accessible.  Thank you for your honest review. 
"
Sony Headphones,Headphones,Great sound quality and comfortable to wear for long periods. The noise cancellation feature works really well in crowded areas.,"positive 
","Thank you for your positive review! We're delighted you're enjoying the sound quality, comfort, and noise cancellation features. We strive to create products that enhance your listening experience.  We appreciate your feedback and are glad you're happy with your purchase. 
"
Samsung Galaxy S21,Phone,A decent phone overall but the performance lags a bit when running multiple apps. Not worth upgrading if you already have the previous version.,"mixed 
","Thank you for your feedback. We appreciate you highlighting the phone's strengths while acknowledging the performance concerns. We are constantly working to improve our devices and will consider your feedback as we develop future models. 
"
Dell XPS 13 Laptop,Laptop,"Excellent build quality and the display is gorgeous. However, the fan can get pretty loud when the system is under heavy load.","mixed 
","Thank you for your detailed review! We appreciate your positive comments about the build quality and display. We understand your concern about the fan noise. We're always working to improve our cooling systems and will consider your feedback as we develop future models. 
"
Apple Watch Series 7,Smartwatch,"I love the fitness tracking features, and the always-on display is super handy. Battery life could be better, but it's still a solid choice.","positive 
","Thanks for the great review! We're thrilled you love the fitness tracking and always-on display. We're always working to improve battery life, and we appreciate your feedback. We're glad you consider it a solid choice!  
"
Kindle Paperwhite,E-reader,"Perfect for reading! The e-ink display is easy on the eyes, and I love that it's waterproof. It's great for reading on the go.","positive 
","We're so happy to hear you're enjoying your e-reader! It's great to know you appreciate the e-ink display and waterproof features. We're glad it's perfect for your reading needs on the go. Thank you for your positive review! 
"
